<?xml version="1.0" encoding="UTF-8"?>
<arvosanasiirto xmlns="http://service.henkilo.sade.vm.fi/types/perusopetus/arvosanat"
                xmlns:xsi="http://www.w3.org/2001/XMLSchema-instance"
                xsi:schemaLocation="http://service.henkilo.sade.vm.fi/types/perusopetus/arvosanat perusaste-arvosanat.xsd">
    <eranTunniste>05127 arvosanat</eranTunniste>
    <henkilot>
        <henkilo>
            <henkilonTunniste>8a08663e-1443-4b39-9056-0694dc0dbe89</henkilonTunniste>
            <hetu>131094-919B</hetu>
            <oppijanumero>1.2.246.562.24.41800604157</oppijanumero>
            <todistukset>
                <perusopetus>
                    <myontaja>05127</myontaja>
                    <valmistuminen>01.06.2014</valmistuminen>
                    <yksilollistaminen>0</yksilollistaminen>
                    <opetuskieli>FI</opetuskieli>
                    <eiValmistu>HYLATTY</eiValmistu>
                    <arvosanat>
                        <AI>
                            <tyyppi>FI_VK</tyyppi>
                            <yleinen>9</yleinen>
                            <valinnaiset>
                                <valinnainen>10</valinnainen>
                                <valinnainen>10</valinnainen>
                            </valinnaiset>
                        </AI>
                        <A1>
                            <kieli>EN</kieli>
                            <yleinen>9</yleinen>
                            <valinnaiset>
                                <valinnainen>10</valinnainen>
                                <valinnainen>9</valinnainen>
                            </valinnaiset>
                        </A1>
                        <A12>
                            <kieli>EN</kieli>
                            <yleinen>9</yleinen>
                            <valinnaiset>
                                <valinnainen>10</valinnainen>
                                <valinnainen>9</valinnainen>
                            </valinnaiset>
                        </A12>
                        <A2>
                            <kieli>EN</kieli>
                            <yleinen>9</yleinen>
                        </A2>
                        <A22>
                            <kieli>DE</kieli>
                            <yleinen>9</yleinen>
                        </A22>
                        <B1>
                            <kieli>SV</kieli>
                            <yleinen>9</yleinen>
                            <valinnaiset>
                                <valinnainen>10</valinnainen>
                                <valinnainen>9</valinnainen>
                            </valinnaiset>
                        </B1>
                        <B2>
                            <kieli>SV</kieli>
                            <yleinen>9</yleinen>
                        </B2>
                        <B22>
                            <kieli>RU</kieli>
                            <yleinen>9</yleinen>
                        </B22>
                        <B23>
                            <kieli>SE</kieli>
                            <yleinen>9</yleinen>
                        </B23>
                        <MA>
                            <yleinen>10</yleinen>
                            <valinnaiset>
                                <valinnainen>9</valinnainen>
                                <valinnainen>6</valinnainen>
                            </valinnaiset>
                        </MA>
                        <BI>
                            <yleinen>10</yleinen>
                            <valinnaiset>
                                <valinnainen>8</valinnainen>
                                <valinnainen>5</valinnainen>
                            </valinnaiset>
                        </BI>
                        <GE>
                            <yleinen>5</yleinen>
                            <valinnaiset>
                                <valinnainen>5</valinnainen>
                                <valinnainen>8</valinnainen>
                            </valinnaiset>
                        </GE>
                        <FY>
                            <yleinen>7</yleinen>
                            <valinnaiset>
                                <valinnainen>7</valinnainen>
                                <valinnainen>8</valinnainen>
                            </valinnaiset>
                        </FY>
                        <KE>
                            <yleinen>7</yleinen>
                            <valinnaiset>
                                <valinnainen>7</valinnainen>
                                <valinnainen>8</valinnainen>
                            </valinnaiset>
                        </KE>
                        <TE>
                            <yleinen>7</yleinen>
                            <valinnaiset>
                                <valinnainen>7</valinnainen>
                                <valinnainen>8</valinnainen>
                            </valinnaiset>
                        </TE>
                        <KT>
                            <yleinen>7</yleinen>
                            <valinnaiset>
                                <valinnainen>7</valinnainen>
                                <valinnainen>8</valinnainen>
                            </valinnaiset>
                        </KT>
                        <HI>
                            <yleinen>7</yleinen>
                            <valinnaiset>
                                <valinnainen>7</valinnainen>
                                <valinnainen>8</valinnainen>
                            </valinnaiset>
                        </HI>
                        <YH>
                            <yleinen>7</yleinen>
                            <valinnaiset>
                                <valinnainen>7</valinnainen>
                                <valinnainen>8</valinnainen>
                            </valinnaiset>
                        </YH>
                        <MU>
                            <yleinen>7</yleinen>
                            <valinnaiset>
                                <valinnainen>7</valinnainen>
                                <valinnainen>8</valinnainen>
                            </valinnaiset>
                        </MU>
                        <KU>
                            <yleinen>7</yleinen>
                            <valinnaiset>
                                <valinnainen>7</valinnainen>
                                <valinnainen>8</valinnainen>
                            </valinnaiset>
                        </KU>
                        <KS>
                            <yleinen>7</yleinen>
                            <valinnaiset>
                                <valinnainen>7</valinnainen>
                                <valinnainen>8</valinnainen>
                            </valinnaiset>
                        </KS>
                        <LI>
                            <yleinen>7</yleinen>
                            <valinnaiset>
                                <valinnainen>7</valinnainen>
                                <valinnainen>8</valinnainen>
                            </valinnaiset>
                        </LI>
                        <KO>
                            <yleinen>7</yleinen>
                            <valinnaiset>
                                <valinnainen>7</valinnainen>
                                <valinnainen>8</valinnainen>
                            </valinnaiset>
                        </KO>
                    </arvosanat>
                </perusopetus>
                <lisaopetus>
                    <myontaja>05127</myontaja>
                    <valmistuminen>01.06.2015</valmistuminen>
                    <yksilollistaminen>0</yksilollistaminen>
                    <opetuskieli>FI</opetuskieli>
                    <arvosanat>
                        <AI>
                            <tyyppi>FI_VK</tyyppi>
                            <yleinen>6</yleinen>
                        </AI>
                    </arvosanat>
                </lisaopetus>
            </todistukset>
        </henkilo>
        <henkilo>
            <henkilonTunniste>abc-1</henkilonTunniste>
            <hetu>111111-1975</hetu>
            <oppijanumero>1.2.246.562.24.00000000001</oppijanumero>
            <todistukset>
                <lukio>
                    <myontaja>00256</myontaja>
                    <valmistuminen>31.12.2015</valmistuminen>
                    <opetuskieli>FI</opetuskieli>
                    <arvosanat>
                        <AI>
                            <tyyppi>FI_VK</tyyppi>
                            <yleinen>9</yleinen>
                        </AI>
                        <A1>
                            <kieli>EN</kieli>
                            <yleinen>9</yleinen>
                        </A1>
                        <A12>
                            <kieli>EN</kieli>
                            <yleinen>9</yleinen>
                        </A12>
                        <A2>
                            <kieli>EN</kieli>
                            <yleinen>9</yleinen>
                        </A2>
                        <A22>
                            <kieli>DE</kieli>
                            <yleinen>9</yleinen>
                        </A22>
                        <B1>
                            <kieli>SV</kieli>
                            <yleinen>9</yleinen>
                        </B1>
                        <B2>
                            <kieli>SV</kieli>
                            <yleinen>9</yleinen>
                        </B2>
                        <B22>
                            <kieli>RU</kieli>
                            <yleinen>9</yleinen>
                        </B22>
                        <B23>
                            <kieli>SE</kieli>
                            <yleinen>9</yleinen>